{
  "repository_type": "global_impact_integration_repository",
  "repository_version": "1.9.0",
  "api_version": "v1",
  "workspace_id": "gic-workspace-bdc75d8b68333af2",
  "generated_at": "2026-07-17T23:05:23.665836+00:00",
  "jsonld_context": {
    "@version": 1.1,
    "gic": "https://sustainablecatalyst.com/ns/global-impact-catalyst/",
    "schema": "https://schema.org/",
    "dcterms": "http://purl.org/dc/terms/",
    "prov": "http://www.w3.org/ns/prov#",
    "sdg": "https://metadata.un.org/sdg/",
    "id": "@id",
    "type": "@type",
    "name": "schema:name",
    "description": "schema:description",
    "datePublished": "schema:datePublished",
    "measurementTechnique": "schema:measurementTechnique",
    "variableMeasured": "schema:variableMeasured",
    "isBasedOn": {
      "@id": "schema:isBasedOn",
      "@type": "@id"
    },
    "wasDerivedFrom": {
      "@id": "prov:wasDerivedFrom",
      "@type": "@id"
    }
  },
  "api_clients": [
    {
      "client_id": "gic-api-client-6d38d5f5c859dd9141cb",
      "workspace_id": "gic-workspace-bdc75d8b68333af2",
      "name": "Platform Core Example",
      "description": "",
      "client_type": "service",
      "lifecycle_status": "active",
      "rate_limit_per_minute": 60,
      "revision": 1,
      "created_by": "example",
      "created_at": "2026-07-17T23:05:23.657203+00:00",
      "updated_at": "2026-07-17T23:05:23.657203+00:00",
      "metadata": {},
      "keys": [
        {
          "api_key_id": "gic-api-key-82faf507dfefd52352a9",
          "scopes": [
            "handoffs:write",
            "workspace:read"
          ],
          "expires_at": null,
          "revoked_at": null,
          "last_used_at": null,
          "created_at": "2026-07-17T23:05:23.657625+00:00"
        }
      ]
    }
  ],
  "embeds": [
    {
      "embed_id": "gic-embed-32e53eb51683875e6353",
      "workspace_id": "gic-workspace-bdc75d8b68333af2",
      "initiative_id": "gic-initiative-09a657f60923ed45",
      "publication_id": "gic-publication-ec04100f2b2b57e4c8dc",
      "publication_snapshot_id": "gic-publication-snapshot-6aa5f90607ee15307436",
      "embed_type": "initiative_card",
      "title": "Approved impact profile",
      "public_slug": "approved-impact-profile",
      "content_hash": "cf4879049f1b9a13fee6b57552bad8c53b399d1f246dda376b7dc198475f9f0a",
      "lifecycle_status": "active",
      "revision": 1,
      "created_by": "example",
      "created_at": "2026-07-17T23:05:23.659123+00:00",
      "updated_at": "2026-07-17T23:05:23.659123+00:00",
      "configuration": {},
      "accessibility": {
        "heading_level": 2,
        "landmark": "region",
        "table_captions": true,
        "text_alternatives": true
      },
      "metadata": {}
    }
  ],
  "platform_handoffs": [
    {
      "handoff_id": "gic-handoff-59a85b9eee2fbe3b9d43",
      "workspace_id": "gic-workspace-bdc75d8b68333af2",
      "initiative_id": "gic-initiative-09a657f60923ed45",
      "destination": "decision_studio",
      "handoff_type": "global_impact_platform_handoff",
      "handoff_version": "1.9.0",
      "status": "ready",
      "source_snapshot_hash": "58965c6ad80c978455cbbf475b5b73cafb46d423dfbfe2c88a1ce3f2a02cdecb",
      "payload_hash": "47bb26e365389df8d3599cf7e8d32bf687eacdf0fa91dbe747bcca83271cf35c",
      "idempotency_key": "example-decision-studio-001",
      "created_by": "example",
      "created_at": "2026-07-17T23:05:23.663357+00:00",
      "delivered_at": null,
      "payload": {
        "@context": {
          "@version": 1.1,
          "datePublished": "schema:datePublished",
          "dcterms": "http://purl.org/dc/terms/",
          "description": "schema:description",
          "gic": "https://sustainablecatalyst.com/ns/global-impact-catalyst/",
          "id": "@id",
          "isBasedOn": {
            "@id": "schema:isBasedOn",
            "@type": "@id"
          },
          "measurementTechnique": "schema:measurementTechnique",
          "name": "schema:name",
          "prov": "http://www.w3.org/ns/prov#",
          "schema": "https://schema.org/",
          "sdg": "https://metadata.un.org/sdg/",
          "type": "@type",
          "variableMeasured": "schema:variableMeasured",
          "wasDerivedFrom": {
            "@id": "prov:wasDerivedFrom",
            "@type": "@id"
          }
        },
        "boundary": "Handoff integrity preserves source identity and governance metadata; receiving systems must retain limitations and may not infer assurance or causal proof.",
        "created_at": "2026-07-17T23:05:23.662489+00:00",
        "data": {
          "analysis": {
            "analysis_runs": [],
            "benchmarks": [],
            "boundary": "Analysis records improve transparency but do not create assurance, certification, causality, or verified forecasts.",
            "comparison_sets": [],
            "generated_at": "2026-07-17T23:05:23.661012+00:00",
            "integrity": {
              "analysis_run_count": 0,
              "benchmark_count": 0,
              "comparison_member_count": 0,
              "comparison_set_count": 0,
              "orphan_comparison_member_ids": [],
              "orphan_sensitivity_run_ids": [],
              "scenario_count": 0,
              "sensitivity_run_count": 0,
              "uncertainty_model_count": 0,
              "valid": true
            },
            "repository_type": "global_impact_analysis_repository",
            "repository_version": "1.7.0",
            "scenarios": [],
            "sensitivity_runs": [],
            "uncertainty_models": [],
            "workspace_id": "gic-workspace-bdc75d8b68333af2"
          },
          "assumptions": [],
          "contract_versions": [
            "1.1.0"
          ],
          "decision_context": [
            {
              "goal": {
                "created_at": "2026-07-17T23:00:00+00:00",
                "entity_type": "goal",
                "id": "gic-goal-ece2bacb67a2be38",
                "initiative_id": "gic-initiative-09a657f60923ed45",
                "sdg_theme": "Affordable and clean energy",
                "statement": "Reduce household energy burden while improving residential efficiency.",
                "updated_at": "2026-07-17T23:00:00+00:00"
              },
              "initiative": {
                "created_at": "2026-07-17T23:00:00+00:00",
                "entity_type": "initiative",
                "id": "gic-initiative-09a657f60923ed45",
                "name": "Community Energy Retrofit Pilot",
                "updated_at": "2026-07-17T23:00:00+00:00",
                "workspace_id": "gic-workspace-bdc75d8b68333af2"
              },
              "measurement": {
                "baseline": {
                  "created_at": "2026-07-17T23:00:00+00:00",
                  "entity_type": "baseline",
                  "id": "gic-baseline-bccde48f17ee3898",
                  "indicator_id": "gic-indicator-2e7a8f93231487ce",
                  "method_id": "gic-method-dfc0b951aac86076",
                  "period": {
                    "label": "2025 baseline"
                  },
                  "source_ids": [
                    "gic-source-f2284ef9ae098b56"
                  ],
                  "unit": "USD",
                  "updated_at": "2026-07-17T23:00:00+00:00",
                  "value": 0.0
                },
                "observations": [
                  {
                    "created_at": "2026-07-17T23:00:00+00:00",
                    "entity_type": "observation",
                    "id": "gic-observation-cca59978f04bb0dd",
                    "indicator_id": "gic-indicator-2e7a8f93231487ce",
                    "method_id": "gic-method-dfc0b951aac86076",
                    "period": {
                      "label": "2026 Q2"
                    },
                    "source_ids": [
                      "gic-source-f2284ef9ae098b56"
                    ],
                    "unit": "USD",
                    "updated_at": "2026-07-17T23:00:00+00:00",
                    "value": 18.0
                  }
                ],
                "target": {
                  "created_at": "2026-07-17T23:00:00+00:00",
                  "direction": "higher_is_better",
                  "entity_type": "target",
                  "id": "gic-target-61bc37e9887a3252",
                  "indicator_id": "gic-indicator-2e7a8f93231487ce",
                  "period": {
                    "label": "2027"
                  },
                  "unit": "USD",
                  "updated_at": "2026-07-17T23:00:00+00:00",
                  "value": 30.0
                }
              },
              "outcomes": [
                {
                  "created_at": "2026-07-17T23:00:00+00:00",
                  "entity_type": "outcome",
                  "goal_id": "gic-goal-ece2bacb67a2be38",
                  "id": "gic-outcome-5dfda192c94fd5fb",
                  "statement": "Participating households experience lower monthly energy costs.",
                  "updated_at": "2026-07-17T23:00:00+00:00"
                }
              ]
            }
          ],
          "initiative_id": "gic-initiative-09a657f60923ed45",
          "monitoring_plan": {
            "observations": [
              {
                "created_at": "2026-07-17T23:00:00+00:00",
                "data_state": "complete",
                "denominator": {},
                "dimensions": {},
                "impact_result_id": "gic-outcome-5dfda192c94fd5fb",
                "indicator_definition_id": "gic-indicator-definition-9746d98980e468bc1b83",
                "indicator_id": "gic-indicator-2e7a8f93231487ce",
                "initiative_id": "gic-initiative-09a657f60923ed45",
                "metadata": {
                  "materialized_from_contract": true,
                  "record_id": "gic-record-3bb3e632355d26c9"
                },
                "method_definition_id": "gic-method-dfc0b951aac86076",